{
  "provider": "aws",
  "version": "2026-01-15",
  "effective_from": "2026-01-15T00:00:00Z",
  "retrieved_at": "2026-10-22",
  "source_url": "https://aws.amazon.com/pricing/",
  "currency": "USD",
  "models": {},
  "default_model": null,
  "per_request_overhead_usd": 0.0,
  "failed_request_overhead_usd": 0.0,
  "chat_endpoints": [],
  "deterministic_post_endpoints": [],
  "downgrade_map": {},
  "batch_equivalents": {},
  "supported": false,
  "legacy": {
    "status": "stub",
    "note": "Provider is listed in the schema but is not proxied or priced in v1."
  }
}
